{
  "$schema": "./models.schema.json",
  "version": 1,
  "models": [
    {
      "id": "claude-opus-5-5",
      "displayName": "Claude Opus 5.5",
      "openclawName": "Claude Opus 5.5 (via CLI)",
      "reasoning": true,
      "contextWindow": 1000000,
      "maxTokens": 128000
    },
    {
      "id": "claude-opus-5",
      "displayName": "Claude Opus 5",
      "openclawName": "Claude Opus 5 (via CLI)",
      "reasoning": true,
      "contextWindow": 1000000,
      "maxTokens": 64000
    },
    {
      "id": "claude-opus-4-8",
      "displayName": "Claude Opus 4.8",
      "openclawName": "Claude Opus 4.8 (via CLI)",
      "reasoning": true,
      "contextWindow": 1000000,
      "maxTokens": 64000
    },
    {
      "id": "claude-opus-4-7",
      "displayName": "Claude Opus 4.7",
      "openclawName": "Claude Opus 4.7 (via CLI)",
      "reasoning": true,
      "contextWindow": 1000000,
      "maxTokens": 64000
    },
    {
      "id": "claude-opus-4-6",
      "displayName": "Claude Opus 4.6",
      "openclawName": "Claude Opus 4.6 (via CLI)",
      "reasoning": true,
      "contextWindow": 200000,
      "maxTokens": 64000
    },
    {
      "id": "claude-sonnet-5-5",
      "displayName": "Claude Sonnet 5.5",
      "openclawName": "Claude Sonnet 5.5 (via CLI)",
      "reasoning": true,
      "contextWindow": 1000000,
      "maxTokens": 128000
    },
    {
      "id": "claude-sonnet-5",
      "displayName": "Claude Sonnet 5",
      "openclawName": "Claude Sonnet 5 (via CLI)",
      "reasoning": true,
      "contextWindow": 1000000,
      "maxTokens": 64000
    },
    {
      "id": "claude-sonnet-4-6",
      "displayName": "Claude Sonnet 4.6",
      "openclawName": "Claude Sonnet 4.6 (via CLI)",
      "reasoning": true,
      "contextWindow": 200000,
      "maxTokens": 32000
    },
    {
      "id": "claude-haiku-4-5-20251001",
      "displayName": "Claude Haiku 4.5",
      "openclawName": "Claude Haiku 4.5 (via CLI)",
      "reasoning": false,
      "contextWindow": 200000,
      "maxTokens": 32000
    }
  ],
  "aliases": {
    "opus": "claude-opus-5-5",
    "sonnet": "claude-sonnet-5-5",
    "haiku": "claude-haiku-4-5-20251001"
  },
  "legacyAliases": {
    "claude-opus-4": "claude-opus-4-7",
    "claude-haiku-4": "claude-haiku-4-5-20251001",
    "claude-haiku-4-5": "claude-haiku-4-5-20251001"
  }
}
